{
  "schema_version": 2,
  "schema_id": "lcf.w01.lifecycle.v2",
  "repository": "fredgnr/local-context-forge",
  "work_id": "W01",
  "pull_request": 20,
  "baseline": {
    "commit": "3eff97d97b2de4484d568bab5ac96d63830c79ee",
    "tree": "21fe2cbe46d42bf351d2b0c84019ee63959081b7"
  },
  "candidate_history": [
    {
      "candidate_id": "W01-original-rejected-final",
      "source_commit": "2b7629468c711d0db5107f7001aa90c0271079ae",
      "source_tree": "ad1b76febd1adcaf1ada96ed7dd43fbe1e5a3adf",
      "technical_source_result": "pass",
      "independent_acceptance": "fail",
      "canonical_activation": {
        "status": "not-eligible",
        "required_conditions": [
          "independent acceptance of the exact final PR head",
          "merge of that accepted candidate into canonical main",
          "successful source-coverage on the exact resulting main commit"
        ]
      },
      "rejection_reason_ids": [
        "W01-EVIDENCE-FUTURE-DESCENDANT-FREEZE",
        "W01-EVIDENCE-MERGE-STRATEGY-INCOMPATIBLE",
        "W01-ARTIFACT-PREMATURE-CANONICAL-PASS"
      ],
      "implementation_checkpoint": {
        "source_commit": "8573f608df589bc2ef9e05f0c75d84887464c825",
        "source_tree": "40c039f240cdd8c6e0589c8608260c3d45c6ebaa",
        "lifecycle_phase": "pull-request-candidate",
        "run": {
          "id": 30927840380,
          "attempt": 1,
          "event": "pull_request",
          "source_ref": "refs/pull/20/merge",
          "exact_checked_out_sha": "8573f608df589bc2ef9e05f0c75d84887464c825",
          "synthetic_context_sha": "29e2498e666cfeebf162aa6bb726954e42d109ea",
          "workflow_path": ".github/workflows/desktop-ci.yml",
          "workflow_sha": "29e2498e666cfeebf162aa6bb726954e42d109ea",
          "url": "https://github.com/fredgnr/local-context-forge/actions/runs/30927840380",
          "conclusion": "success",
          "job_results": {
            "python": "success",
            "web": "success",
            "desktop": "success",
            "macos-ipc": "success",
            "source-coverage": "success"
          }
        },
        "payload_artifact": {
          "id": 8899870692,
          "name": "w01-source-coverage-8573f608df589bc2ef9e05f0c75d84887464c825",
          "source_commit": "8573f608df589bc2ef9e05f0c75d84887464c825",
          "run_id": 30927840380,
          "archive_sha256": "9dc17f1163f9b111aff8b7ae603574d6c22f552e269e1cac299754c23051a91a",
          "inner_json_sha256": "e1a9b65e44b8258d8529c7018d64e3865b8135dc4677e9b9e6904484cb8bc6e7",
          "payload_schema_version": 1
        },
        "provenance_artifact": null,
        "provenance_absence_reason": "pre-v2 single-artifact lifecycle",
        "technical_gate_results": {
          "VAL-PRE1-SEQUENCE-001": "pass",
          "VAL-GOV-001": "pass",
          "VAL-CI-COVERAGE-001": "pass"
        },
        "legacy_payload_canonical_gate_results": {
          "VAL-PRE1-SEQUENCE-001": "not-run",
          "VAL-GOV-001": "not-run",
          "VAL-CI-COVERAGE-001": "not-run"
        },
        "tool_versions": {
          "python": {
            "python-version": "Python 3.12.13",
            "qmd-node-version": "v22.23.2",
            "npm-version": "10.9.8",
            "uv-version": "uv 0.11.29 (x86_64-unknown-linux-gnu)"
          },
          "web": {
            "node-version": "v24.18.0",
            "npm-version": "11.16.0"
          },
          "desktop": {
            "node-version": "v24.18.0",
            "npm-version": "11.16.0"
          },
          "macos-ipc": {
            "architecture": "arm64",
            "python-version": "Python 3.12.10",
            "uv-version": "uv 0.11.29 (901092ee1 2026-07-15 aarch64-apple-darwin)"
          }
        },
        "qmd_source": {
          "tests": {
            "tests": 11,
            "pass": 10,
            "fail": 0,
            "cancelled": 0,
            "skipped": 1,
            "todo": 0
          },
          "allowed_skip_reason": "better-sqlite3 native binding is not built in source checkout",
          "network_trap": "active",
          "network_policy": "deny-external-allow-af-unix",
          "model_scan": {
            "scope": [
              "isolated HOME",
              "isolated XDG_CACHE_HOME",
              "isolated XDG_CONFIG_HOME",
              "isolated XDG_DATA_HOME",
              "isolated TMPDIR"
            ],
            "repository_worktree_scanned": false,
            "global_tmp_scanned": false,
            "model_files_created": 0,
            "model_cache_paths_created": 0,
            "scope_basis": "v1 isolated_home_xdg_tmp result plus reviewed runner environment mapping"
          }
        },
        "guide_site": {
          "disposition": "external-blocked",
          "included": false,
          "validated": false
        }
      },
      "final_source_execution": {
        "source_commit": "2b7629468c711d0db5107f7001aa90c0271079ae",
        "source_tree": "ad1b76febd1adcaf1ada96ed7dd43fbe1e5a3adf",
        "lifecycle_phase": "pull-request-candidate",
        "run": {
          "id": 30929070329,
          "attempt": 1,
          "event": "pull_request",
          "source_ref": "refs/pull/20/merge",
          "exact_checked_out_sha": "2b7629468c711d0db5107f7001aa90c0271079ae",
          "synthetic_context_sha": "cb844bfb5502f948bf55a227300a12761427195e",
          "workflow_path": ".github/workflows/desktop-ci.yml",
          "workflow_sha": "cb844bfb5502f948bf55a227300a12761427195e",
          "url": "https://github.com/fredgnr/local-context-forge/actions/runs/30929070329",
          "conclusion": "success",
          "job_results": {
            "python": "success",
            "web": "success",
            "desktop": "success",
            "macos-ipc": "success",
            "source-coverage": "success"
          }
        },
        "payload_artifact": {
          "id": 8900365901,
          "name": "w01-source-coverage-2b7629468c711d0db5107f7001aa90c0271079ae",
          "source_commit": "2b7629468c711d0db5107f7001aa90c0271079ae",
          "run_id": 30929070329,
          "archive_sha256": "b446ef4e84eb60dfd3da5322c85737d8dab960a349933a565fd5bd7ed3965e4d",
          "inner_json_sha256": "4d0deeb7fc6886e03c671e0df2dbc80b03586c6222a38ad27549a0a3f42c403d",
          "payload_schema_version": 1
        },
        "provenance_artifact": null,
        "provenance_absence_reason": "pre-v2 single-artifact lifecycle",
        "technical_gate_results": {
          "VAL-PRE1-SEQUENCE-001": "pass",
          "VAL-GOV-001": "pass",
          "VAL-CI-COVERAGE-001": "pass"
        },
        "legacy_payload_canonical_gate_results": {
          "VAL-PRE1-SEQUENCE-001": "pass",
          "VAL-GOV-001": "pass",
          "VAL-CI-COVERAGE-001": "pass"
        },
        "tool_versions": {
          "python": {
            "python-version": "Python 3.12.13",
            "qmd-node-version": "v22.23.2",
            "npm-version": "10.9.8",
            "uv-version": "uv 0.11.29 (x86_64-unknown-linux-gnu)"
          },
          "web": {
            "node-version": "v24.18.0",
            "npm-version": "11.16.0"
          },
          "desktop": {
            "node-version": "v24.18.0",
            "npm-version": "11.16.0"
          },
          "macos-ipc": {
            "architecture": "arm64",
            "python-version": "Python 3.12.10",
            "uv-version": "uv 0.11.29 (901092ee1 2026-07-15 aarch64-apple-darwin)"
          }
        },
        "qmd_source": {
          "tests": {
            "tests": 11,
            "pass": 10,
            "fail": 0,
            "cancelled": 0,
            "skipped": 1,
            "todo": 0
          },
          "allowed_skip_reason": "better-sqlite3 native binding is not built in source checkout",
          "network_trap": "active",
          "network_policy": "deny-external-allow-af-unix",
          "model_scan": {
            "scope": [
              "isolated HOME",
              "isolated XDG_CACHE_HOME",
              "isolated XDG_CONFIG_HOME",
              "isolated XDG_DATA_HOME",
              "isolated TMPDIR"
            ],
            "repository_worktree_scanned": false,
            "global_tmp_scanned": false,
            "model_files_created": 0,
            "model_cache_paths_created": 0,
            "scope_basis": "v1 isolated_home_xdg_tmp result plus reviewed runner environment mapping"
          }
        },
        "guide_site": {
          "disposition": "external-blocked",
          "included": false,
          "validated": false
        }
      }
    }
  ],
  "remediation": {
    "finding_ids": [
      "W01-EVIDENCE-FUTURE-DESCENDANT-FREEZE",
      "W01-EVIDENCE-MERGE-STRATEGY-INCOMPATIBLE",
      "W01-ARTIFACT-PREMATURE-CANONICAL-PASS"
    ],
    "checkpoint_a": null,
    "checkpoint_a_record_sha256": null,
    "technical_source_result": "pending",
    "independent_acceptance": "pending",
    "final_containing_head_binding": {
      "mode": "attached-exact-head-payload-and-provenance",
      "workflow_path": ".github/workflows/desktop-ci.yml",
      "workflow_name": "Desktop source CI",
      "events": [
        "push",
        "pull_request",
        "workflow_dispatch"
      ],
      "source_expression": "${{ github.event.pull_request.head.sha || github.sha }}",
      "required_jobs": [
        "python",
        "web",
        "desktop",
        "macos-ipc"
      ],
      "summary_job": "source-coverage",
      "payload_artifact_prefix": "w01-source-coverage-",
      "provenance_artifact_prefix": "w01-source-coverage-provenance-"
    },
    "canonical_activation": {
      "status": "blocked",
      "required_conditions": [
        "independent acceptance of the exact final PR head",
        "merge of that accepted candidate into canonical main",
        "successful source-coverage on the exact resulting main commit"
      ]
    }
  },
  "canonical_main_source": {
    "status": "not-run",
    "source_commit": null,